{"$id":"/schemas/WorkflowDefinition.schema.json","$schema":"https://json-schema.org/draft/2020-12/schema","additionalProperties":false,"properties":{"authority":{"$ref":"./AuthorityProfile.schema.json"},"body":{"items":{"oneOf":[{"$ref":"./OperationDefinition.schema.json"},{"$ref":"./CompositeDefinition.schema.json"}]},"type":"array"},"constraints":{"items":{"$ref":"./GovernanceConstraint.schema.json"},"type":"array"},"context":{"additionalProperties":false,"properties":{"discloses":{"items":{"type":"string"},"type":"array"},"requires":{"items":{"type":"string"},"type":"array"}},"required":[],"type":"object"},"evidence":{"items":{"$ref":"./EvidenceReference.schema.json"},"type":"array"},"id":{"type":"string"},"inputPorts":{"items":{"$ref":"./PortDefinition.schema.json"},"type":"array"},"name":{"type":"string"},"outputPorts":{"items":{"$ref":"./PortDefinition.schema.json"},"type":"array"},"purpose":{"type":"string"},"schemaVersion":{"pattern":"^\\d+\\.\\d+\\.\\d+$","type":"string"},"version":{"pattern":"^\\d+\\.\\d+\\.\\d+$","type":"string"},"contentDigest":{"type":"string","pattern":"^[0-9a-f]{64}$","description":"Canonical digest of this artifact with the contentDigest member itself excluded; verified by the canonical verifier (SOMA-CMP-0004)."},"repoRevision":{"type":"string","description":"Repository revision this workflow definition was frozen at; resume tokens must pin the same revision (SOMA-RES-0001)."},"kind":{"enum":["atomic","composite"]},"references":{"type":"array","items":{"type":"string"},"title":"Referenced artifact ids; unknown ids are SOMA-CMP-0002"},"effectExports":{"type":"array","items":{"type":"object","additionalProperties":false,"required":["name"],"properties":{"name":{"type":"string"}}},"title":"Effects exported by this workflow; unit effects outside this set are SOMA-EXP-0007"},"authorityImports":{"type":"array","items":{"type":"string"},"title":"Authority capabilities a composite imports; unit grants outside this set are SOMA-AUTH-0002"}},"required":["schemaVersion","id","version","name","inputPorts","outputPorts","body","authority"],"title":"WorkflowDefinition","type":"object"}
